<?xml version="1.0" encoding="UTF-8" ?>
<!DOCTYPE law PUBLIC "DemoWave//law//0.1.0" "/home/redhog/Projects/DemoWave/DemoWave/DTD/law/0.1.0.dtd">
<law>
 <p>
  <h>para 1</h>
  text 1
  <p>
   <h>para 1.1</h>
   text 1.1
  </p>
  <p>
   <h>para 1.2</h>
   text 1.2
  </p>
 </p>
 <p>
  <h>para 2</h>
  text 2
 </p>
</law>
